{
  "package_id": "92d0a9f1-1cf2-4530-9943-92a1501849ec",
  "content_hash": "616d5b52bc054660adb410a1d2e83d9508588d17bd54011a564dd64e97b1adae",
  "generated_at": "2026-09-29T09:16:22.230783+00:00",
  "principal_id": "c58a3ea1-9c8d-4bee-8766-e0a1d9b27f57",
  "relevant_work": [
    {
      "id": "3c089b4d-b24f-4585-af6c-fc215fd23f51",
      "state": "succeeded",
      "due_at": "2026-09-29T09:15:21.042322+00:00",
      "task_id": "6de09726-4cef-405a-95e1-b1040f437881",
      "retry_at": null,
      "created_at": "2026-09-29T09:16:21.042324+00:00",
      "attempt_count": 2,
      "claim_version": 2,
      "fulfillment_id": "11b441c3-0a16-4d35-b992-f9d7f681f826",
      "occurrence_key": "SYNTHETIC-FIRST",
      "record_version": 8,
      "schema_version": "1.0.0",
      "priority_override": null,
      "ready_override_at": null,
      "work_definition_id": "b5b86f2c-8af1-4e91-9837-02eadbb97f2d",
      "stage_definition_id": "09c7511d-8f39-4ad0-b6ae-5c9329fe23b8"
    },
    {
      "id": "42fb6536-3e92-4d94-8ff1-959c853d7dfd",
      "state": "succeeded",
      "due_at": "2026-09-29T09:16:22.080774+00:00",
      "task_id": "21b33ea3-0022-4fca-b832-51ec5de17eec",
      "retry_at": null,
      "created_at": "2026-09-29T09:16:22.080774+00:00",
      "attempt_count": 2,
      "claim_version": 2,
      "fulfillment_id": "d1a6d421-3cb8-4365-bf70-a00815d1625f",
      "occurrence_key": "SYNTHETIC-STAGED-approval",
      "record_version": 8,
      "schema_version": "1.0.0",
      "priority_override": null,
      "ready_override_at": null,
      "work_definition_id": "b5b86f2c-8af1-4e91-9837-02eadbb97f2d",
      "stage_definition_id": "0c8a552a-6d5b-41f6-b6df-d4e91ddd5bb0"
    },
    {
      "id": "59c3e6a5-1c7e-4267-8226-cbb530c6787e",
      "state": "succeeded",
      "due_at": "2026-09-29T09:16:22.031068+00:00",
      "task_id": "21b33ea3-0022-4fca-b832-51ec5de17eec",
      "retry_at": null,
      "created_at": "2026-09-29T09:16:22.031068+00:00",
      "attempt_count": 2,
      "claim_version": 2,
      "fulfillment_id": "d1a6d421-3cb8-4365-bf70-a00815d1625f",
      "occurrence_key": "SYNTHETIC-STAGED-provider",
      "record_version": 8,
      "schema_version": "1.0.0",
      "priority_override": null,
      "ready_override_at": null,
      "work_definition_id": "b5b86f2c-8af1-4e91-9837-02eadbb97f2d",
      "stage_definition_id": "610521ad-aad4-4395-95fb-cb9db8d63356"
    },
    {
      "id": "a2766798-9a90-4621-8598-dde6677c4e3c",
      "state": "succeeded",
      "due_at": "2026-09-29T09:16:21.931118+00:00",
      "task_id": "21b33ea3-0022-4fca-b832-51ec5de17eec",
      "retry_at": null,
      "created_at": "2026-09-29T09:16:21.931118+00:00",
      "attempt_count": 2,
      "claim_version": 2,
      "fulfillment_id": "d1a6d421-3cb8-4365-bf70-a00815d1625f",
      "occurrence_key": "SYNTHETIC-STAGED-human",
      "record_version": 8,
      "schema_version": "1.0.0",
      "priority_override": null,
      "ready_override_at": null,
      "work_definition_id": "b5b86f2c-8af1-4e91-9837-02eadbb97f2d",
      "stage_definition_id": "bc740a5d-b32d-4666-a4fe-09a524b4d71d"
    },
    {
      "id": "c24e3c57-77d6-40cc-9742-22f8e6cd9f14",
      "state": "succeeded",
      "due_at": "2026-09-29T09:16:22.130816+00:00",
      "task_id": "21b33ea3-0022-4fca-b832-51ec5de17eec",
      "retry_at": null,
      "created_at": "2026-09-29T09:16:22.130816+00:00",
      "attempt_count": 2,
      "claim_version": 2,
      "fulfillment_id": "d1a6d421-3cb8-4365-bf70-a00815d1625f",
      "occurrence_key": "SYNTHETIC-STAGED-deterministic",
      "record_version": 8,
      "schema_version": "1.0.0",
      "priority_override": null,
      "ready_override_at": null,
      "work_definition_id": "b5b86f2c-8af1-4e91-9837-02eadbb97f2d",
      "stage_definition_id": "2bb8a403-3ffd-4eeb-a7b9-65c024caacb9"
    },
    {
      "id": "fdcb1f7b-dd56-4393-9a6f-c02e507d1a7f",
      "state": "succeeded",
      "due_at": "2026-09-29T09:16:21.981477+00:00",
      "task_id": "21b33ea3-0022-4fca-b832-51ec5de17eec",
      "retry_at": null,
      "created_at": "2026-09-29T09:16:21.981477+00:00",
      "attempt_count": 2,
      "claim_version": 2,
      "fulfillment_id": "d1a6d421-3cb8-4365-bf70-a00815d1625f",
      "occurrence_key": "SYNTHETIC-STAGED-semantic",
      "record_version": 8,
      "schema_version": "1.0.0",
      "priority_override": null,
      "ready_override_at": null,
      "work_definition_id": "b5b86f2c-8af1-4e91-9837-02eadbb97f2d",
      "stage_definition_id": "d5d92971-2b95-472c-9135-28d39166c2f7"
    }
  ],
  "schema_bundle": [
    {
      "sha256": "4a3aa37ece5546de4ce4afd00f32b4420725498afd0de3d768583fff5ef0c80f",
      "document": {
        "$id": "https://contracts.ecos.invalid/v1/approval_decision.schema.json",
        "type": "object",
        "title": "approval_decision",
        "$schema": "https://json-schema.org/draft/2020-12/schema",
        "required": [
          "id",
          "schema_version",
          "created_at",
          "approval_request_id",
          "decision",
          "actor_id",
          "reason_code",
          "evidence",
          "supersedes_decision_id"
        ],
        "properties": {
          "id": {
            "type": "string",
            "format": "uuid"
          },
          "actor_id": {
            "type": "string",
            "format": "uuid"
          },
          "decision": {
            "enum": [
              "approved",
              "rejected",
              "changes_requested",
              "expired",
              "revoked"
            ],
            "type": "string"
          },
          "evidence": {
            "type": "array",
            "items": {
              "$ref": "https://contracts.ecos.invalid/v1/evidence.schema.json"
            },
            "minItems": 0,
            "uniqueItems": false
          },
          "created_at": {
            "type": "string",
            "format": "date-time"
          },
          "reason_code": {
            "type": "string",
            "pattern": "^[a-z][a-z0-9_.-]{0,127}$"
          },
          "schema_version": {
            "const": "1.0.0"
          },
          "approval_request_id": {
            "type": "string",
            "format": "uuid"
          },
          "supersedes_decision_id": {
            "anyOf": [
              {
                "type": "string",
                "format": "uuid"
              },
              {
                "type": "null"
              }
            ]
          }
        },
        "additionalProperties": false
      },
      "schema_id": "https://contracts.ecos.invalid/v1/approval_decision.schema.json"
    },
    {
      "sha256": "5d4d03dfdb3530bfba823c78d6bfdf03933b0085d850b346a329f1d2123d1b58",
      "document": {
        "$id": "https://contracts.ecos.invalid/v1/approval_request.schema.json",
        "type": "object",
        "title": "approval_request",
        "$schema": "https://json-schema.org/draft/2020-12/schema",
        "required": [
          "id",
          "schema_version",
          "created_at",
          "record_version",
          "task_id",
          "subject_type",
          "subject_id",
          "subject_hash",
          "state",
          "expires_at"
        ],
        "properties": {
          "id": {
            "type": "string",
            "format": "uuid"
          },
          "state": {
            "$ref": "https://contracts.ecos.invalid/v1/vocabulary.schema.json#/$defs/approval"
          },
          "task_id": {
            "anyOf": [
              {
                "type": "string",
                "format": "uuid"
              },
              {
                "type": "null"
              }
            ]
          },
          "created_at": {
            "type": "string",
            "format": "date-time"
          },
          "expires_at": {
            "type": "string",
            "format": "date-time"
          },
          "subject_id": {
            "type": "string",
            "format": "uuid"
          },
          "subject_hash": {
            "type": "string",
            "pattern": "^[a-f0-9]{64}$"
          },
          "subject_type": {
            "type": "string",
            "pattern": "^[a-z][a-z0-9_.-]{0,127}$"
          },
          "record_version": {
            "type": "integer",
            "minimum": 1
          },
          "schema_version": {
            "const": "1.0.0"
          }
        },
        "additionalProperties": false
      },
      "schema_id": "https://contracts.ecos.invalid/v1/approval_request.schema.json"
    },
    {
      "sha256": "55a2477b9e5a8291c211f14864fee4d9ecbc0e4e7bb5049994086c2f86215b42",
      "document": {
        "$id": "https://contracts.ecos.invalid/v1/approval.decide-request.schema.json",
        "type": "object",
        "title": "approval.decide-request",
        "$schema": "https://json-schema.org/draft/2020-12/schema",
        "required": [
          "schema_version",
          "context",
          "arguments"
        ],
        "properties": {
          "context": {
            "$ref": "https://contracts.ecos.invalid/v1/request_context.schema.json"
          },
          "arguments": {
            "type": "object",
            "required": [
              "approval_request_id",
              "expected_version",
              "decision",
              "subject_hash",
              "reason_code"
            ],
            "properties": {
              "decision": {
                "enum": [
                  "approved",
                  "rejected",
                  "changes_requested"
                ],
                "type": "string"
              },
              "reason_code": {
                "type": "string",
                "pattern": "^[a-z][a-z0-9_.-]{0,127}$"
              },
              "subject_hash": {
                "type": "string",
                "pattern": "^[a-f0-9]{64}$"
              },
              "expected_version": {
                "type": "integer",